{"contractVersion":"native-k8s/v1","runId":"run-2","namespace":"bench","jobId":"job-2","imageDigest":"sha256:1111111111111111111111111111111111111111111111111111111111111111","imageReference":"registry.example.com/aiperf/runner@sha256:1111111111111111111111111111111111111111111111111111111111111111","cells":4,"artifactRoot":"/results","configRef":{"name":"config-2","sha256":"0000000000000000000000000000000000000000000000000000000000000000"},"controllerAddress":"controller:443","roles":[{"name":"controller","command":["aiperf"],"argv":["controller"],"environment":{},"bootstrap":{"secretName":"bootstrap-controller","role":"controller","mountPath":"/bootstrap","sha256":"1111111111111111111111111111111111111111111111111111111111111111"}},{"name":"cell","command":["aiperf"],"argv":["cell"],"environment":{}},{"name":"results-sidecar","command":["aiperf"],"argv":["results-sidecar"],"environment":{}}],"cellBootstraps":[{"cellId":0,"secretName":"bootstrap-cell-0","mountPath":"/bootstrap","sha256":"1111111111111111111111111111111111111111111111111111111111111111"},{"cellId":1,"secretName":"bootstrap-cell-1","mountPath":"/bootstrap","sha256":"1111111111111111111111111111111111111111111111111111111111111111"},{"cellId":2,"secretName":"bootstrap-cell-2","mountPath":"/bootstrap","sha256":"1111111111111111111111111111111111111111111111111111111111111111"},{"cellId":3,"secretName":"bootstrap-cell-3","mountPath":"/bootstrap","sha256":"1111111111111111111111111111111111111111111111111111111111111111"}]}
